{
  "schema": "ai_studio.capture.delivery_constraint.v1",
  "id": "instagram-reels-v1",
  "version": 1,
  "platform": "instagram",
  "surface": "reels",
  "status": "official_partial",
  "source": {
    "url": "https://www.facebook.com/help/1038071743007909",
    "reviewed_at": "2026-07-26"
  },
  "constraints": {
    "containers": [],
    "aspect_ratios": ["9:16"],
    "video_codecs": [],
    "audio_codecs": [],
    "sample_rates": [],
    "min_width": 720,
    "min_fps": 30,
    "notes": [
      "Instagram publishes accepted aspect range through 9:16, minimum 30 FPS, and minimum 720-pixel resolution, but this source is not a complete codec/color contract."
    ]
  }
}
